sentence,char_count
"alhamdulillah, onek valo ek ta jinsh। ank valooo running। tnx darajke, bjbharer pe bujhte prbo kemn  divais। pe review dibo।",125
"daam as pnjer gun gt quality ank bhlo! now dekhar pala how long use krte pari! seller re onek thanks, dlvry guy onnk valo cilo! thanks drz",144
"daam as pnjer gun gt quality ank valooo tobe pnjti and lil bit strong hole bhalo hoto ! now dekhar pala kotodin use korte pari! seller ke ank thanks, dlvry guy onnk vlo chilo! thx drz",183
besh bhlo legechhe।,16
it laganr pore iutiub o intarnet pachi | divaista android | bhal jinish mne hchhe |,80
average goes। dlv sm mt peechhi। bt HD mode video chole na। nw bks pharst iuj krtei tphite apdet cha। apdetsh eps deoa uchit silo।,140
jinis ta valoi। knt edaptar ta aro bhalo hole vlo lagto,57
Valo products,13
onnk bhal। running kub vlo vabei। slr smer agei pathiechhe। dlvry guy bhalo cilo।,82
anek valooo  sba nite paro,26
shotti oshadharon chilo।apnara niye paren chokh bndh kore,49
"bad product 
eta keu kinben na",30
vlo prod if anyone niye chan nirdidha nite paren💯,52
"alhdlh ei product ta onk valooo, mi  use kori।",58
valoi coltise ekhono,20
mutamuti ase। bhaloi tar preo quality maan kshunn।,47
khubi valooo ek ta jinis sobai niye paro,36
onnk shundor ek ti pradakt  darun running। kom takar inside etai besht।,66
alhamdulillah khub bhlo,23
Tank you so much,16
"dam onujai jthesht,, kotodin tiksi h setai b kotha।",49
jinsh ta mutamuti valooo caile sobai niye paro❤️❤️❤️,50
It's good product.,18
"shob 100 te 100, but amarta rmot dead।
ki korte pari ekon?",59
all kicu milie onnk vlo। sbai nite paro।,42
onnk valo 2 din chalie  rv  gave ur niye  parin,54
vlo।tobe remote ta arektu bhlo hlei ht।,38
sobkicu tiktak cilo।bhaloi running..,30
"jtta hope krechhilam his/her cheeo ank bhlo।
tnx।",47
ek ktha osadharn ei bajete। seller kotha kaje mil rekhechhe।,53
"ek ktha oshadharon, sobkicu thikthak cilo",35
ek ti awesome mal। u all nite paro,35
15 day use korar pr review gave। khub e vlo।,45
u amader sathe jogajog kore dekha gel apni purono bat bebohar krechhilen ur smsjar smadhan now hoyeche asha kori rvw bhlo diben,131
4 mash use korar por ses,24
paojar ojadaptar chenjj kore dekhte paren,41
"sb oke ache   
Hdmi caabol balu na
tpi eps  kaj kre na",53
apnader tivi bksti vlo,23
bhaloi chltachhe,12
valoee,6
onnk chenel gula chlte chai na,27
use kore valo laglo,19
silarer respns less,18
"kpi product vebechhilam real ta opharer j kichu taka less,, bat diechhe kpi,, and taka barie dile ashol product nite partam,, aamar rv derite dear karn amar kachhe HDMI to AV converter  cilo na,, if thakto, tahle return kore ditam,,,",224
seller mteo bhlo nah,18
valoi colsa,11
bhaloi tb khb light orjinal naa hat theke smanj uchu thke  prlei bengge chur mar he jbe r leg kore,94
bhal tb bidjut works gele ghir taim bar bar ok kre dea takes etar kono bjbstha thakle janaben,92
average valoi। knt dur from rimut work kore nah baki all ok ache।caile all nite paren।,87
valu kintu majhe majhe diskanekt hje jai er no smadhan ki ase,63
"emnite bidio koaliti khub bhalo, but tulnamulk shlo work kre",61
vlo prodact but majhe majhe hjangk kore।,39
prodaktti bhlo majhe majhe slo kaj kre,39
kubi bhal maner product sobai niye paro।,37
tivi bks goes na amdr bks tivite। rvw dekhe kinchhilam knt ekhon chole naa।tivi bkse issue naki tivite bujhte parchhina। price according to koaliti thik ace shob kichhur mone holo। but chole naa problem oi jaga। onj karo tivite lagie chek korar sujog apatt naa।tai bks apatt rekhe dichchhi nijer kachhei।,286
prodaktta bhalo na work kore,27
kubi baje ekta jinsh। price onujai ekdom karap। khub slo eita,59
eta ashle ekta pjarar jinis jinishta valo bat oparetingta birktikr,67
ami monitor e challachhi ।saund hchchhe na।  ki problem,52
ekdom baje Av port kaj kore na,28
valo na vhai keo niben nah onk baje ar onek nrml,47
mi kicu blbo naa        olp pjsa jar pcha begun his/her,52
pendraiv saport krtechhe na,27
apni amader sathe jogajog korar por dekha gel ur pendraiv shomossha cilo,69
jinish ta vlo,12
sjar prdt bad hole rakhben no return kore den kintu aapni to setao krtechhen nah tarmane ur kachhe prdt bhalo legechhe,125
ebi kanekshn work kre nah. it ok hjni,37
bhai khela dekhar jonno ki kon eps nah?,35
hjang kore bhal nah,17
erkm problem hole to aapni amdr sathe jogajog krten u ur intarnet spid badan issue smadhan hje jabe,107
kanekted h nah return korte hechhe,34
e pnjtakeo kinben nah,22
nst silo। rtrn krechi।,24
mal bhal na,10
khubi baze,10
🤬🤬🤬,3
"mashallah product khubi bhlo। red cheechhilam so peechhi। peij respns and vlo।  aro agei dlv peejetam,,kintu desher ei obstha deri hoa sbavabik। packing valo cilo। net slo thakar karne pikchar ejad kra jachchhena, pore kre dib inshllh। 

thnks slr vaia ke, eto koaliti phul product rijenebl e dear jnno।",320
"khb sundor ,niye paro।",23
"awesome, sundor ek ti jinsh,",27
kub shundor hoice color ta onk shundor hoice। color silekt korte parchhilam naa jnno kharap lagchhil। ekon khb kushi। thx seller bro ke। shathe kjekta chuler rabar phri pichi,170
"duti ordr krechhilam। osmvb druttm sme shipping krechhen slr। packing oshadharon buddhimtta nie kra cilo je karne dutor konotitei ekchul ghsha lageni। nihsndehe order korte paren। koaliti khubi valo and ruchismmt asbabptrer sathe manansi। thanks slr, daraz r raidar sbaike।",277
"oshadharon prod! ekdom chhbir mti। seller khb antrikebng respnsiv chilen। jei color dite blechhilam, setai diechhen। onek thx। uprer dhaknata mjagnetik sisteme lagano stays, bjaparta besh vlo legechhe। u all caile nite paro। 
tb bkser sz kichhuta coto, nrmal saijer tisjubks gulo vitre rakha ja naa। tai mi bks from tisju ber kore erpr rekhechhi।",348
seller re mesej kre golden clr othba red kalarer talk bla sttbeo pingk color pathano hechhe। bjaparta moteo fav hni।,118
"je rnger bks cheechhilam, seti i peechhi, seller r bebahar khb i vlo silo।  
prdt o mashallah onk bhal diechhen + bks tao onnk sundor।",134
seal already broken chilo box er.. used product new hisebe diyeche kina shondeho hocche,87
alhamdulillah। 10 tarikhe ordr krechhilam 12 date  skale peye gijechhi । jemnta chejechhi tk temnta peyechi । dlv mjano ank bhlo chilen । sbmile 10/10,156
batch number ta online e verify korle invalid dekhay.. counterfeit product daraz e bechhe ei seller,99
prdt ta osmvb sundor।  seller ank bhlo।  that cheechhi setai peichhi bat dlvry ta onk leit koreche।  3 tarikher ordr 18 date dlv peechhi,145
"prdt prais hisabe motamuti valooo bat order korechi oph hojait dijechhen bljak clr it moteo ok hjni।
mi darajer selarderke onurodh korbo customer ja order kreche prdt ok ta if thke stays delivery krben sem oi prodact stke na thakle onj color ba onj prdt dije diben nah ete darajer bdnam more hoy।  thnks",328
koaliti khubi valooo silo। packing & kub valo chilo। 485 taka eto more koalitiphul jinsh pab vabteo parini। prdt ta kholar pr khb bsh kushi hechhi 😍🥰❤️,151
"r ageo duto niechhilam। ekhon arekta nilam, khub i sundor। 
r delivery onk phast silo porshu ordr korechi today pee giechhi।❤️",123
mashallah  tisju baksti sundor। ami slr vaike shada dite blechhilam tini tai diechhe।stvabe bjbsa kre egije jan।,114
alhamdulillah। orijinal prod tulnamulk diskaunt praije। karo pochondo hole nite paren। delivarimjano ank bhalo cilo druto dlv peechhi। seller ke thanks❤️,160
2ta nilam 2tai sundor,21
panchta order krechhilam। pachtai sundr। thjangks। gtokal order korechi aji hate peechhi।,84
prodaktti onek sundor caile nite paro fav hbe inshallah amar khub like hoice।,83
tisju bks peychi। shada rngjer tisju bks ordr krechhilam bt peychi pink rnger tisju bks। prodakter quality bhlo knt white rngjer hole also valooo hoto।,164
"onk sundr sobai niye paro
dlvry man bhal onek jtn shkare dlv diyeche",81
hand e peyechi vlo chilo tobe cheyechilam shada gold bt gave kalo gold।,75
"order krechhilam white diechhe pingk colour, durvagjjnk, kivabe it smvb?",71
"khub fav hoyeche,, dam according to qlty besh bhalo। all niye paro। 😍",70
"esb cheater from apnara sabdhan thakben। kenar before ekti bar hloo chinta krben। ur ekta clr like hichhe, u shkh kre pchhndmt je color niben। ederke u jti rikojest koren। era but apnar fav mt colour dibe na। era their ichchhamt  ek ta dije dibe। after blbe eta mistek hoice। ami ordr korechi red, amare gave white color। kreta der drishti akrshn kore blchhi। apnra ekhan thke na kine। krokarij dokan thke dekhe shune kinben। etai sbcheje ur jnno bhlo hobe। r like mt to buy parben। thnks।...",499
alhmdu jemnta cheechhilam temntai peechhi thanks daraz ke,63
etar qlty onk bhalo design ta onnk shundor apnar nite paro,63
"good 
bt ami vebechhilam ektu hebi hbe, after saw plastic।",63
"golden colour bolar preo blu color pathaichhe
jttsb 
return krchhi",63
alhamdulillah prodaktta khubi sundr aamar onek valooo lagchhe,59
bhai phaijlamir ekta limit ace aami ki kinchhi and ki dichhen।,54
"onk shundor। that blechhi otai diyeche, tnx।💁‍♂️🌸",51
"onnk shundor। jeta blechhi otai gave, thnks।",46
ank sundor। apnara caile nite paren।,37
egula  ekdom mn mt hichhe jemnta chaichhilam,38
"🔥🔥🔥🔥🔥hjan ekdom phresh intact ekti prodact amake gave & color jeta cheyechilam seitai dijechhi ekdm phresh 
dhonnobad seller👍 thanks daraz timke👍 prodtai jthajthvabe sundrvabe pjaketing kora silo apnara caile ordr krte paro jinisti ghrer (EXTRA)soundrj bje anbe",261
onek bhal sbai  nite paro।,27
darun bks ti metal bdi।,24
"koaliti besh bhal। 
cheechhilam hoait golden ta but etao besh sundor।",68
ek clr majher golden colour ta nai।,36
onk bhalo,9
"daam onujai eto laksari jinish kkhno hope krini। eto shundor, chhbir chaite bastbe aro beshi sundor। thjangks।",102
"💗assalamu alaikum 💗

🌺[ alhdlh ]🌺 shbdti lekhar pore ar kichhui thake nah lekhar mt। jai hok more kichu likhbo'i aamar bhlo lagar bishta! amar and amar chhatrder sklei pochondo hechhe। slr vaiake ank vabe blchhi je vaia bhalo vabe pjakajing kore diben, thik vaia aamar kotha onujai ato krra vabe packaging krchhen allahr ksm amar khulte pra 8/9 minute sm lagchhe।khub e primiam ekta bks 🥰
jerkm cheechhi masha-allah ok serkm'i peechhi।🌺 1 ktha 100% piur ek ta tisur bks। je anyone srasri tisur bks gulo dekhlei ek chanjche fav krbe aami mne kori। if anyone e tisur bks gulo nite ichchhuk take blbo ei vaiar kachh thke nishchite niye paren  apnar asha vngg hbe nah ingsha allah, asha kori। vaiake allah ta'ala valooo rakhuk, ameen 🤲",704
Excellent. dekhte khub e sundr। niye paro। mul‍j bahirer chee less ekhane। dhn‍jbad।,81
"seller er use khub e antrik 
tb problem hocche tisju bster vitre besi tisju rakha jai nah",92
"jinish bhlo average chilo kintu delivery srvc ekdm bad, arekbar BD-EDesh e dlvry dile risiv krb na।",104
pnjer quality vlo। pjakejinger maan bhalo na so ekta pa vangga chhile। ektu babl repar dile r emnta hoto nah।,104
👌👌👌,3
"aami blchhi tisju bksta red rong giving jonno, blchhil red rong dibe, but red rong de nai, badami kalarer tisju bks diyeche। but tisju bksta onnk sundor alhamdulillah,thikthak ace।ank valo legechhe, lal rong hole also sundor lagto",223
"dite blechhi ek colour kintu diechhe onj clr।
😡😡😡😡😡",51
onnk valo quality er ek ti prdt chaile sobai nite paren,52
drz and seller re tnx।  bhalo vabe peechhi। all nite paro।,60
100% orijinal silo ur niye paro,34
"vhai aami onnk khushi, amar pchhnder colour ti pie, thanks daraz slr o velivari man ke, apnar sob tme grahk der chahida purn krben,tahlei bhalo review paben । sbaike abar antrik shuvechchha and ovinndn।",198
item vlo knt color ta tk mto dejni,41
"average bhal bla chole , dekhteo besh shundor, but uprer daknate thaka choumbk uthe ase lagte chaj na eituku shomossha bjtit overall good product 👍",138
alhmdu kichu bolar vasha naai,33
"Recommended. Value of Money.
selarke inbkse golden kalar dite blechhilam, tini ta-i diechhen। dhnjbad selarke। 
Seller 10/10
Delivery 10/10",138
"order diechhi tisu bks, diechhe hear bjand। eta mene nea ja na। bjbsaik sttar ovab rechhe। asa krchhi sabdhan hben।",117
"tisju mte bkser size ektu choto, but plastiker hoa sttbeo standard o phinishing valo! primiam vaib de! ❤️ krer ago cheting e talk ble niben!


bikretar proti nsih emon stta shkare grahkder product diben!
jajakallahu khaer......❤️",231
"khub e chamotkar,  but cheyechilam lalta dilen white tai htash hlam। lalta pele aro khushi htam। 
kint prodact bhalo, prod according to damtao ok ase।
dhonnobad । all niye paro",173
mi white color ta ordar krechhilam kintu dilo black colour 😡। but dekhte shundor ache। mjterial ta kiser bojha jachchhe nah। steel taip kicu hole valo hto। mebi ektu valooo quality er plastic।,179
"Wow, nice product,jemnta cheechhi temntii peechhi, bastbe chhbir cheeo shundor, slr ke countless thanks, seller vaike chjate ja blechhi tini sei pnjtii diechhe, je anyone nirdhidba nite paren",182
"onk sundor ekta tisju holdar,, je kon prdt order krar pr valo vabe hate na paoa prjnt ekta tenshn thake,, slr vaike valo ek ta prod dear word ank bar ble birkt korechi,, alhdlh bhalo ekta product kub bhalo vabe pkg kore uni diechhen,, raidar vaio khb antrik,,  product delivarir sm onnk antrikta chilo tar majhe,,,",343
valo prdt। nite paro all।price onujai onnk bhalo। luk ta osthir tisju biks tar।tobe plastiker knt onk hard vabe kra,128
alhmdu onnk shundor ami duinijechhi ekta vlo dekhe abar arekta order krchhi ❤️❤️❤️,87
ekebarei chobir moto,20
ekta valooo hoyeche arekti color jbla djamej aami e productTa riples kre vlo ek ti ponno chai,86
"mashallah apnader jinish ebong packing onnk sundr, aami onk happy। jara chan niye paren",85
order dilam shada end gold kintu amake dlv dilo silvar klar ei seller bhal naa jodi chao onj kothao from parcel krte pare।,125
"ophiser jnno niechhi।soundrj briddhi krar j besh karjkr। 
pjakejingtao valo chilo।",82
tisju bksta shundor। jodi chao u all nite paren।,46
prodakta onek  vlo  hechhe।karo valolagle nite paro ar dlv  mjano bhal।,79
"totali phaltu, pa vangga & achano prodact dicche, batparder theke anyone nien na",76
"khub valo   product, packing o valooo chilo।",38
vlo cilo kint sadar jajgaj black gave। e jnno ektu mn khrp।,67
kub balo products 🥰💥,20
bhalo but aami order krchhilam shada golden amake send hoice red,64
ek kthaj tisju bks amazing silo । inshllh vbishjte more nib ।,64
amake vangga ek ta prod dilen ken bhai aami vangga tk t dei nei,64
onnk ank thnks daraz ktripkshke ❤️❤️,38
"tisju bkser pajer ek jajgaj clr uthe gechhe। mul pjaketti torn dumano and mochdano obsthaj paoa gechhe। it mi gipht deoar j kinechhilam, gipht pepare moate and gipht dite oshubidha hbe।",187
ekktha oshadharon। mulyo onujai bhal maner product peyechi,54
alhamdulillah ank sundor ❤️❤️❤️,33
valo laglo!,11
"ji।
it vlo chilo💟
e dame it best prod।",45
khb bhalo apnara nite paro mi charti niechhi,43
"khb valooo ebong shundor hchhe,all niye paren।",41
price onujai khubi bhlo quality er product।,38
emon dekhchhi temni paisi।sbai nite paren,38
alhdlh ank bhalo & sundor,33
bks bhlo tb tisjubks ate nah।,32
osdharn chilo,10
"ank bar kinechi, vishn sundr",28
thnks seller ke eto sundor packing kore product dear j।eto phresh product aslei oshadharon।,94
je rkm cheechhilam serkmi peechhi।,31
onk sundor laghce tnx,21
khb vlo r sundr।,20
sobai nite paren l,18
oshadharon tisu bks,17
good khub shundor,17
ank lightweight।,11
goog quality,12
valo ciloo ❤️,13
shundor 🥰,9
valo cole,9
vlo awesome,10
valo e,6
Vlo,3
khub e shundor price er tlna। je keo niye paro। Recommended. dhn‍jbad।,66
vitrer vitre char saide charta mjagnet stays jar madhjme dhaknata dhre keeps tinta mjagnet ache ekpashe nai ami chheleke blechhilam vhai lil bit chek kre dijen uni ki chek krchhe seta aamar bodhgmj na tb selarer uchit silo aamar prophail ta dekhe neoja ami tarader ekjn regularly customer aamar shathe emon krata sjalari thik hoi nah,307
prod ta onek onek shundor pichi thnks drz ke eto sundr prdt giving j,87
alhamdulillah kub darun hoice,31
drz ke thx vlo product deoar jonno।,39
tisju bks ta amar khubi pochondo hechhe। onek derite rvw gave। tnx mner mto deoar jonno।,92
ordr dilam ek color। dilen onj clr। htash। evabe protarona nah krleo parten।,78
khub bhlo item। seller vaier bebahar bhalo sthik clr peechhi 😁😁😁,62
"alhamdulillah kub vlo paichi,,,",32
"ek ktha awesome,,,,,",20
"alhamdulillah,,bhal lagchhe",26
onk classy,10
jinish brabr chhbir mti। bastbe onk sundor felt।,47
onnk beshi shundor,16
sundor chilo 🖤,13
order krechhilam  white  diechhe blue color । protorok,49
chailam white and golden colour. apni dilen Green colour.  Customer jeita cha seta dite h. eta shikhte hbe.,105
"khub valo prdt, all niye paren।",35
ekdm phaltu। pic dekha ekta ar prod de arekta।,51
odar diechhi gold and white diechhe golapi,39
white colour cheechhilam ta pini। onj clr peechhi।,49
"alhmdu hand e peyechi, ekhon khaojar por bla jabe kttuku upkare ase, and ktta karjkr",89
"bangladeshi product considering e prodakttir gungtman and  sad jthesht bhlo and karjkarita o bhaloi hosse eti dije tinti khachchhi। tobe paudarti arektu mihi ba mulajem hole khete r lil bit mja lagto, kompani e bishjti khejal rakhben।",223
smmanit kreta apnader prtjekti mtamt amdr nikt khubi gurutbpurn। grin niutrishn phuds kompanir shathe thakar jnno apnake oshongkho dhonnobad।।,142
"e nije ta khelam,,prtibari 3-4 keji ojn badijechhe,,arektu badate chachchhi tai nilam,,ago onek pusht cilo khete,, ektu problem hoto,,ekhon ager thke susbadu r patla hoyeche,, shjei panir shathe mishe jay,,but etar standard and karjkarita kmechhe naki eta khelei bajte parb,,,",268
apnader prtiti mtamt amader nikt khubi gurutbpurn। GN FOODS BD D-Mall Flagship Seller Brand Shop er sathe thaka apnake dhnjbad।,128
smmanit kreta apnader prtjekti mtamt amader nikt kubi gurutbpurn। 2014 sal theke ji en  brander phangshnal phud ttha nirapd pushtikhadj kthor bishuddhikrn prkrijaj prstutkrit product samgri nie apnader sebaj beside achhi thakbo inshallah। grin niutrishn phuds kompanir with thakar jonno apnake oshongkho thx।।,309
smmanit kreta apnader prtjekti mtamt amader nikt khub e gurutbpurn। 2014 sal thke ji en  brander phangshnal phud ttha nirapd pushtikhadj kthor bishuddhikrn prkrijaj prstutkrit ponno samgri nie apnader sebaj pashe achhi thakbo inshallah। grin niutrishn phuds kompanir shathe thakar jnno apnake oshongkho thx।।,309
smmanit kreta apnader prtjekti mtamt amader nikt khubi gurutbpurn। 2014 sal theke ji en  brander phangshnal phud ttha nirapd pushtikhadj kthor bishuddhikrn prkrijaj prstutkrit ponno samgri nie apnader sebaj pashe achhi thakbo inshallah। grin niutrishn phuds kompanir sathe thakar j apnake countless thanks।।,309
prthmbar order korlam।seller khb antrik। btir shathe chhotti phri diechhe।seller ke thnks।,86
"apnader prtiti mtamt amader nikt khubi gurutbpurn। GN FOODS BD D-Mall Flagship Seller
 Brand Shop er sathe thaka apnake dhnjbad",128
"today hte pailam।  jinsh vlo paisi, peket bhlo jtn kre kra।  bhlo lagchhe।  now khai er pr dekha jak ki h। 🫡❤️‍🩹",108
"mone hocche eti ekti bhlo prodact tobe ekta kheje temon ekta tphat bujhte parini। jehetu aami badite homojarkaut kori so prtidin duti kore seddh dim khai & ojark auter pr ek skop ojetgeinar khai। echhadao sptahe dui tin din chiken khai, phlsbrup ojn samanj bedechhe and masel bild hosse। ami eti kinechhilam 1732 taka r eti ekhon bede pray dui hajar takar kachhakachhi hje gechhe। sbar j sajeshn thakbe apnra 2000 takar prakritik khabar (jemon doinik duiti kore seddh dim mase 60 ti dim jar daam 700 takar inside) theke protin vitamin and minarels nije ek mas look paren। asha kori r thekeo valo phl paben inshallah। thx",617
"3 kouta shesh arekti nilam matr 7 keji ojn beechhe tate aamar no aptti nah, khee jthesht mja peechhi no said iphekt h nah,  mi prodakter proti kub  asthashil। ri",160
"apnader sntushti orjni amdr ekmatr lkshj।  aamra qlt kntroler srbochch schesht thaki,  sundr mtamt prkash krar jnno grin niutrn phors kompanir pksh theke apnake thanks।",183
alhmdu kaitechhi dekha jak ki obstha kemn work kore kajta bojhar pr abar prbrtite review deb inshallah,105
"mi abar order dib,  kom dame ekta prakritik upadane toiri sapliment।  mi stereder ve ve chhilam,  hand e paoar 3-4 day prjnt priksha nirikshar pr shior hichhi।  ekhon nirve khachchhi।  r mi ekjn hard geinar,  kkhnoi pet vre khete pari naa ruchi pai naa।  eta khee amar shrirer inside ek ta shanti lage sbsm। daam arektu kom hole mase 2 ta kore kintam",342
"it 2 bar kena।
prthm ta kinchhi,,khaichhi,tkhn chenjj ter paichhilam halka।
kintu nimit khaite pari nei,tai pribrtn h nei।
ekhon eta khabo,chenjj naa hole,bad,oet gein nah hole except die dibo।।

sadh vlo,।
kharap na।
ekhon dekhb oet gein h ki nah।",233
awesome   ek ti prodakts   age  1 ti  kheechhilam  again nilam।  kompani ditks  gipht o phri dlv  diechhe  thnks seller re।,126
"ekti order dijechhi ebar kheje dekhar pala kheje dekhi ki kemn kaj hoy tarpr again review debo,,,,, alhmdu onek upkar peychi 5 day pr rv gave",150
delivery srvc bhlo cilo delivarir ager day phone kre knpharm kra hjechhil। prodaktti 3-4 diner mdhjei pie gechhi। bangladesher product look ank sundr khete sbadta onek bhalo jara nite chan nije niye paren। nij desher udjoktader egije jete sahajj krun। apnra jodi chao iutiube vid ache sekhan thekeo dekhe nite paro। prodakter nam likhe sarch krlei hbe।,355
"dlvry kub druto peychi ,ekdiner modhye। prodact risiv korar pr their kmiuniti thke aamar sathe jogajog koreche ebong khabarer prkrija r ekti dajet pljan tara amake provaid koreche। their customer saport jthesht bhal। ekhon kheje dekhi je kttuk kaj kore bakita allah vrsa। prodaktti othentik apnara nite paren eti aamar trph theke rikmend।",339
rejalt shottii sntoshjnk and sbado wow। aamar 3 mase 10 keji ojn bedechhe।  shrire jthesht shkti pasi। ekon prjnt no said iphekt ba problem hosse na।  srbopri bhaloi mone hocche।  prodakttir  quality dhre rakhben ashakri। Highly Recommended 👍,244
ji sjar apnake thx sundr mntbjer jnno।  amra quality dhre rakhbo inshallah।  Thanks to valuable review,110
onnk onnk thx aamar edresta ektu vul hjechhil ekdiner bjbdhane dlvry  give hoice। dlv guy ta ank bhalo chilo।,124
"thnks darajke। 
prdaktti aaj hand e pelam। ekhon er karjkarita kttuku dekha will go।",82
smmanit kreta apnader prtjekti mtamt amdr nikt kubi gurutbpurn।  grin niutrishn phuds kompanir shathe thakar jonno apnake countless tnx।,142
kemn jani eta khaojar pr shrir durbol hje jay oi jani na ken emnta amar kachhe ekta valooo mone hoi,95
eta khele to more shrire shkti asar word aapni pashapashi dim dudh kla khaben,68
"paudar ta like that mihi nah..!
arektu valooo mto mishle,  khete more vlo lagto..!
sbad average valoi",93
thanks to reviw,15
product jthesht valo kheteo mja knt damta lil bit more mne hoi damta kicu kmanor onurodh janachchhi। thnks bhlo prodact bikri krar jnno।,138
smmanit kreta apnader prtjekti mtamt amdr nikt khub e gurutbpurn। grin niutrishn phuds kompanir sathe thakar j apnake countless thanks।।,142
jemnti asha krechhilam his/her theke bhal ti pichi।eti khaoja end hole arekti ordr krbo। dui tin  kejir mtojn bedechhe alhamdulillah,127
smmanit kreta apnader prtjekti mtamt amader nikt kubi gurutbpurn। grin niutrishn phuds kompanir shathe thakar jnno apnake countless tnx।।,142
aami duita khejechhi matr 4 keji ojn bedechhe apnara blechhen mase tin-char keji badbe kintu aamar ta baenai still mi apnader towards happy karn ota khete khub bhal lagchhe sbad ta onk valo। amar no said iphekt hoi nah। ago onj ek ti kompanir ta khejechhilam। amake haspatale vrti hte hjechhil।  jien phud bidi shper seller ke thanks। bhalo product giving j।,356
smmanit kreta ur ekti pjetiv  review & 5 Star rate kretagnder sthik ponno krje utsahit kore। GN FOODS BD er sathe thakar jnno apnake oshongkho thx।।,154
"selarer bjabhar kubi bhalo. phone kre ble diechhen kivabe khete hbe.& botar with chhotota phri diechhen. thikthak peechhi,khee ekon dekhar bish upkar h naki. inshllh hope krchhi bhal kicu hobe.",184
smmanit kreta ur ek ti pjetiv  rvw & 5 Star rating kretagnder sthik product krje utsahit kre। GN FOODS BD er sathe thakar j apnake oshongkho thx।।,154
"eta test chholadaler mishrit,
 asha kori vlo hbe today peechhi delivery
thnks!",76
hand e peechhi jani nah kemn hbe। tobe khee valooo hole abar order korbo inshllh।,76
khete valooo but aro mihi gudo hole bhlo hoto,44
"jinish ta besh bhlo mne hocche।  dui din dhre khachchhi। 
dekhi phidbjak kemn h।",72
mukh ta chilo kora chilo naa। unbox ei rkm obsthaj peyechi। er karn ki?,64
eta hiter karne hoice jodio kono prob nai yet if mone koren then riplesment r bjbstha ace ejnj apnake kompanir  ht laine jogajog krte hobe। 01711291786 samanj trutir jonno amra duhkhit bishjti kshma sundor drishtite dekhben।,230
ami ei nije 4 ta khelam | 100% karjkr caile nije look paro,62
thanks sjar sundr mtamter jonno,33
sjar apnar kothao vul hocche eta kompani theke srasri delivery hoice kpi hojar konrup sujog nai apnar jodi erpro sndeh thake u it nije chjalenjj krte paro। thanks sjar mtamter j।,189
smmanit kreta ur ekti pjetiv  rvw & 5 Star rate kretagnder sthik ponno krje utsahit kre। GN FOODS BD er with thakar j apnake oshongkho dhonnobad।।,154
"podakt hand e peechhi dekha jak, phuuchare bla will go rejalt kemn",59
